{
  "$schema": "../../schema/docgen.schema.json",
  "version": 1,
  "site": {
    "title": "Sample documentation",
    "description": "Documentation of Sample.Library, generated by Meziantou.DocumentationGenerator.",
    "basePath": "/"
  },
  "output": "artifacts/site",
  "cacheDirectory": "artifacts/cache",
  "packages": [
    { "id": "Sample.Library", "version": "1.0.0", "path": "artifacts/packages/Sample.Library.1.0.0.nupkg" }
  ],
  "content": { "root": "docs" },
  "xrefs": [
    { "namespace": "System", "url": "https://learn.microsoft.com/dotnet/api/{uid}" }
  ]
}
